[
  {
    "record_id": "d6db3fde84354739",
    "timestamp": "2026-04-21T09:45:29+00:00",
    "kind": "runtime",
    "topic": "route-repair-closeout",
    "summary": "When a repaired route unblocks the main task, persist the learning before resuming; a user reminder counts as a trigger miss.",
    "status": "repaired",
    "confidence": "high",
    "failed_path": "Learning loop not applied proactively after Claude Code route debugging in ShopifyMCP_Codex.",
    "repaired_path": "Add an explicit before-resume checkpoint and treat user reminders as trigger-miss evidence.",
    "evidence": [
      "User explicitly pointed out that auto-learning should have been applied proactively after the route repair.",
      "Claude Code route debugging ended with a repaired path that was ready for reuse before the learning loop was run."
    ],
    "notes": [
      "This incident is reusable doctrine, not project memory."
    ],
    "source_skill": "my-personal-verified-learning-loop",
    "source_session": "2026-04-21-ShopifyMCP_Codex-route-debug",
    "agent": "codex",
    "target_files": [
      "/Users/benjaminperry/.agents/skills/my-personal-verified-learning-loop/SKILL.md",
      "/Users/benjaminperry/.agents/skills/my-personal-verified-learning-loop/references/triggering-rules.md",
      "/Users/benjaminperry/.agents/skills/my-personal-verified-learning-loop/references/runtime-hooks.md",
      "/Users/benjaminperry/.agents/skills/my-personal-verified-learning-loop/references/implementation-checklist.md"
    ],
    "extensions": {},
    "canonical_change_candidate": true
  }
]
